exp1/stage12_final_evaluation_v3/paper_final_evaluation/PAPER_RESULTS_TABLE.csv

Model,Dataset,Train,Validation,Test,Best Epoch,Best Val Acc.,Test Acc.,Sparsity,MAC Reduction,Fixed64 Dense Cycles,Fixed64 Sparse Cycles,Adaptive Cycles,Avg PE,Status
ResNet18,CIFAR10,45000,5000,10000,144,0.9586,0.9513,62.51186579895019,72.24934835338311,86784000000,24083125525,24083125525,64.0,PASS
ResNet18,CIFAR100,45000,5000,10000,134,0.7758,0.7697,57.68464033508301,68.28395165353061,86784000000,27524455397,27524455397,64.0,PASS
VGG16,CIFAR10,45000,5000,10000,127,0.8948,0.8846,83.45374636136567,89.59230678816175,48936960000,5093208664,5093208664,64.0,PASS
VGG16,CIFAR100,45000,5000,10000,139,0.6618,0.6557,53.85006880540114,69.98297529719868,48936960000,14689419372,14689419372,64.0,PASS

exp1/stage12_final_evaluation_v3/FINAL_REPORT.md

## 6. Training results

- resnet18/cifar10: epochs=150, best_val=0.9586, status=PASS
- resnet18/cifar100: epochs=150, best_val=0.7758, status=PASS
- vgg16/cifar10: epochs=150, best_val=0.8948, status=PASS
- vgg16/cifar100: epochs=150, best_val=0.6618, status=PASS

## 18. Main findings

- resnet18/cifar10: dense_accuracy=0.9513, sparse_accuracy=0.9513, MAC_reduction=72.24934835338311%, cycle_reduction=72.24934835338311%, average_active_PEs=64.0
- resnet18/cifar100: dense_accuracy=0.7697, sparse_accuracy=0.7697, MAC_reduction=68.28395165353061%, cycle_reduction=68.28395165353061%, average_active_PEs=64.0
- vgg16/cifar10: dense_accuracy=0.8846, sparse_accuracy=0.8846, MAC_reduction=89.59230678816175%, cycle_reduction=89.59230678816175%, average_active_PEs=64.0
- vgg16/cifar100: dense_accuracy=0.6557, sparse_accuracy=0.6557, MAC_reduction=69.98297529719868%, cycle_reduction=69.98297529719868%, average_active_PEs=64.0